{
  "version": 1,
  "question": "Виберіть відповідь, потім натисніть 💡 — відкриється пояснення.",
  "options": [
    "Надіслати: вона сама попросила її сфотографувати.",
    "Надіслати лише бабусі й попросити не пересилати.",
    "Не надсилати: згода на знімання не означає згоди на пересилання.",
    "Закрити обличчя наліпкою й усе одно надіслати."
  ],
  "correct_option": 3,
  "description": "Дев’ятирічна донька сама попросила сфотографувати її в карнавальному костюмі\\. Після знімка сказала: «Тільки нікому не надсилай»\\. Ви хотіли показати фотографію в сімейному чаті\\. Як вчинити?",
  "explanation": "Сфотографувати ≠ переслати\\. «Нікому» стосується й бабусі; наліпка не замінює згоди\\. [Повний розбір]({{telegraph.url}})",
  "telegraph": {
    "title": "Фото дитини: сфотографувати — не означає переслати",
    "text": "# Фото дитини: сфотографувати — не означає переслати\n\nДев’ятирічна донька сама попросила сфотографувати її в карнавальному костюмі. Після знімка сказала: «Тільки нікому не надсилай». Ви хотіли показати фотографію в сімейному чаті. Як вчинити?\n\n**Правильна відповідь — третя (В): не надсилати. Згода на знімання не означає згоди на пересилання.**\n\n## Розбір варіантів\n\n**А. Надіслати: вона сама попросила її сфотографувати.**\n\nПрохання «сфотографуй мене» стосується створення знімка. Дорослий додає до нього іншу дію — показати фотографію людям, яких дитина не обирала глядачами. У цій ситуації донька вже уточнила своє рішення: «Нікому». Вважати початкове прохання дозволом на надсилання — означає проігнорувати це уточнення.\n\n**Б. Надіслати лише бабусі й попросити не пересилати.**\n\nУ слові «нікому» немає винятку для близьких родичів. Прохання до бабусі не пересилати знімок стосується подальшого поширення, але не відповідає на головне запитання: чи згодна донька, щоб фотографію отримала бабуся? Дитина цього не дозволяла. Любов бабусі до онуки й бажання дорослого її потішити не змінюють умови, яку висловила донька.\n\n**В. Не надсилати: згода на знімання не означає згоди на пересилання.**\n\nЦя дія відповідає домовленості. Можна сказати: **«Добре, нікому не надішлю. Дякую, що сказала».** Потім справді нікому не надсилати фото. Не потрібно вимагати переконливого пояснення відмови чи одразу починати торгуватися: «Ну хоча б бабусі?» Дитина не мусить доводити, що знімок поганий, щоб не хотіти ним ділитися.\n\n**Г. Закрити обличчя наліпкою й усе одно надіслати.**\n\nНаліпка змінює зображення, але не замінює згоди. Донька попросила не надсилати фотографію, а не лише приховати її обличчя. Якщо згодом вона сама захоче поділитися зміненим знімком, можна разом обрати конкретну версію та одержувача. Зараз дозволу на такий варіант немає.\n\n## Правило для запам’ятовування\n\n**Сфотографувати ≠ переслати.**\n\nЦим діям відповідають два різні запитання: «Можна сфотографувати?» і «Можна надіслати цей знімок ось цим людям?» Позитивна відповідь на перше не дає відповіді на друге. Якщо дитина вже сказала «не надсилай», наступний крок дорослого — виконати прохання.\n\nПеред надсиланням корисно подумки перевірити три речі: **який знімок, кому, чи є згода**. У нашому випадку остання відповідь — «ні». Отже, фотографію не надсилаємо.\n\n## Згадайте без підказки\n\n1. Донька дозволила надіслати фотографію бабусі. Чи можна заодно надіслати її в загальний сімейний чат?\n2. Згадайте коротке правило та вимовте одну репліку дорослого в початковій ситуації.\n\n**Перевірте себе:** 1. Ні: дозвіл стосувався бабусі, а не всіх учасників чату. 2. «Сфотографувати ≠ переслати». Наприклад: «Добре, нікому не надішлю». Повторіть правило пізніше, перш ніж ділитися наступною фотографією дитини.\n\n## На чому ґрунтується принцип\n\neSafety Commissioner рекомендує окремо обговорювати з дитиною знімання й те, як, навіщо та з ким дорослий хоче поділитися зображенням, а також поважати відмову. У рекомендаціях щодо згоди наголошено, що її дають вільно, без тиску. [Приватність дитини](https://www.esafety.gov.au/parents/issues-and-advice/privacy-child), [згода на поширення фото та відео](https://www.esafety.gov.au/young-people/consent-sharing-photos-videos).\n\nСитуація, варіанти та репліки — навчальний приклад, створений для цього квізу."
  }
}
